{
  "$schema": "https://json-schema.org/draft/2020-12/schema",
  "$id": "https://quality-harness.dev/schemas/qeg/gate-verdict.schema.json",
  "title": "Gate Verdict",
  "type": "object",
  "required": [
    "metadata",
    "verdict",
    "reasons",
    "disqualifications",
    "blockers",
    "residualRisks",
    "requiredHumanReview",
    "testEvidenceAccounting",
    "reliability"
  ],
  "additionalProperties": false,
  "properties": {
    "executionAccounting": { "$ref": "execution.schema.json#/$defs/accounting" },
    "evaluationScope": { "$ref": "input-contract.schema.json#/$defs/evaluationScope" },
    "metadata": { "$ref": "shared-defs.schema.json#/$defs/metadata" },
    "verdict": { "$ref": "shared-defs.schema.json#/$defs/gateVerdict" },
    "reasons": { "type": "array", "items": { "type": "string" } },
    "disqualifications": {
      "type": "array",
      "items": { "$ref": "#/$defs/disqualification" }
    },
    "blockers": {
      "type": "array",
      "items": { "$ref": "#/$defs/blocker" }
    },
    "residualRisks": {
      "type": "array",
      "items": { "$ref": "shared-defs.schema.json#/$defs/stableId" }
    },
    "requiredHumanReview": {
      "type": "array",
      "items": { "$ref": "shared-defs.schema.json#/$defs/stableId" }
    },
    "testEvidenceAccounting": {
      "$ref": "#/$defs/testEvidenceAccounting"
    },
    "reliability": {
      "$ref": "#/$defs/reliability"
    }
  },
  "$defs": {
    "disqualification": {
      "type": "object",
      "required": ["code", "message", "nodeIds", "sourceRefs"],
      "additionalProperties": false,
      "properties": {
        "code": {
          "enum": [
            "DQ-01",
            "DQ-02",
            "DQ-03",
            "DQ-04",
            "DQ-05",
            "DQ-06",
            "DQ-07",
            "DQ-08",
            "DQ-09",
            "DQ-10",
            "DQ-11",
            "DQ-12",
            "DQ-13",
            "DQ-14",
            "DQ-15",
            "DQ-16",
            "DQ-17",
            "DQ-18",
            "DQ-19",
            "DQ-20",
            "DQ-21"
          ]
        },
        "message": { "type": "string", "minLength": 1 },
        "nodeIds": { "type": "array", "items": { "type": "string" } },
        "sourceRefs": {
          "type": "array",
          "minItems": 1,
          "items": { "$ref": "shared-defs.schema.json#/$defs/sourceRef" }
        }
      }
    },
    "blocker": {
      "type": "object",
      "required": ["id", "message", "riskIds", "sourceRefs"],
      "additionalProperties": false,
      "properties": {
        "id": { "$ref": "shared-defs.schema.json#/$defs/stableId" },
        "message": { "type": "string", "minLength": 1 },
        "riskIds": { "type": "array", "items": { "type": "string" } },
        "sourceRefs": {
          "type": "array",
          "minItems": 1,
          "items": { "$ref": "shared-defs.schema.json#/$defs/sourceRef" }
        },
        "ruleId": { "enum": ["BLK-REL-01", "BLK-REL-02", "BLK-REL-03", "BLK-REL-04"] },
        "testId": { "$ref": "shared-defs.schema.json#/$defs/stableId" },
        "evidenceId": { "$ref": "shared-defs.schema.json#/$defs/stableId" },
        "effective": { "type": "boolean" },
        "waiverId": { "$ref": "shared-defs.schema.json#/$defs/stableId" }
      }
    },
    "testEvidenceAccounting": {
      "type": "object",
      "required": ["countedTestIds", "excludedMockTests"],
      "additionalProperties": false,
      "properties": {
        "countedTestIds": {
          "type": "array",
          "items": { "$ref": "shared-defs.schema.json#/$defs/stableId" }
        },
        "excludedMockTests": {
          "type": "array",
          "items": {
            "type": "object",
            "required": ["testId", "reason", "sourceRefs"],
            "additionalProperties": false,
            "properties": {
              "testId": { "$ref": "shared-defs.schema.json#/$defs/stableId" },
              "reason": { "const": "mock_test" },
              "sourceRefs": {
                "type": "array",
                "minItems": 1,
                "items": { "$ref": "shared-defs.schema.json#/$defs/sourceRef" }
              }
            }
          }
        }
      }
    },
    "reliability": {
      "oneOf": [
        {
          "type": "object",
          "required": ["enabled"],
          "additionalProperties": false,
          "properties": { "enabled": { "const": false } }
        },
        {
          "type": "object",
          "required": ["enabled", "requiredRiskCount", "qualifiedRiskCount", "passingRiskCount", "riskCoverageRate", "requiredExecutionCount", "qualifiedExecutionCount", "passingExecutionCount", "resiliencePassRate", "recoverySecondsP50", "recoverySecondsP95", "recoverySampleCount", "duplicateSideEffectsCount", "dataInconsistenciesCount", "evidenceAgeHours", "excludedMockTests", "dqCountByRule", "drillDown"],
          "additionalProperties": false,
          "properties": {
            "enabled": { "const": true },
            "requiredRiskCount": { "type": "integer", "minimum": 0 },
            "qualifiedRiskCount": { "type": "integer", "minimum": 0 },
            "passingRiskCount": { "type": "integer", "minimum": 0 },
            "riskCoverageRate": { "type": ["number", "null"], "minimum": 0, "maximum": 1 },
            "requiredExecutionCount": { "type": "integer", "minimum": 0 },
            "qualifiedExecutionCount": { "type": "integer", "minimum": 0 },
            "passingExecutionCount": { "type": "integer", "minimum": 0 },
            "resiliencePassRate": { "type": ["number", "null"], "minimum": 0, "maximum": 1 },
            "recoverySecondsP50": { "type": ["number", "null"], "minimum": 0 },
            "recoverySecondsP95": { "type": ["number", "null"], "minimum": 0 },
            "recoverySampleCount": { "type": "integer", "minimum": 0 },
            "duplicateSideEffectsCount": { "type": "integer", "minimum": 0 },
            "dataInconsistenciesCount": { "type": "integer", "minimum": 0 },
            "evidenceAgeHours": { "type": "object", "additionalProperties": { "type": "number", "minimum": 0 } },
            "excludedMockTests": { "type": "array", "items": { "$ref": "#/$defs/testEvidenceAccounting/properties/excludedMockTests/items" } },
            "dqCountByRule": {
              "type": "object",
              "required": ["DQ-12", "DQ-18", "DQ-19", "DQ-20", "DQ-21"],
              "additionalProperties": false,
              "properties": {
                "DQ-12": { "type": "integer", "minimum": 0 },
                "DQ-18": { "type": "integer", "minimum": 0 },
                "DQ-19": { "type": "integer", "minimum": 0 },
                "DQ-20": { "type": "integer", "minimum": 0 },
                "DQ-21": { "type": "integer", "minimum": 0 }
              }
            },
            "drillDown": { "type": "array", "items": { "$ref": "#/$defs/reliabilityDrillDown" } }
          }
        }
      ]
    },
    "reliabilityDrillDown": {
      "type": "object",
      "required": ["riskId", "testId", "selectionReason", "disqualificationCodes", "blockerIds"],
      "additionalProperties": false,
      "properties": {
        "riskId": { "$ref": "shared-defs.schema.json#/$defs/stableId" },
        "testId": { "$ref": "shared-defs.schema.json#/$defs/stableId" },
        "selectedEvidenceId": { "$ref": "shared-defs.schema.json#/$defs/stableId" },
        "adapter": { "type": "string" },
        "experimentId": { "$ref": "shared-defs.schema.json#/$defs/stableId" },
        "attempt": { "type": "integer", "minimum": 1 },
        "targetRevision": { "type": "string" },
        "environmentId": { "type": "string" },
        "selectionReason": { "type": "string", "minLength": 1 },
        "exclusionReason": { "type": "string" },
        "disqualificationCodes": { "type": "array", "items": { "type": "string" } },
        "blockerIds": { "type": "array", "items": { "$ref": "shared-defs.schema.json#/$defs/stableId" } }
      }
    }
  }
}
